id_tweet,created_at,tweet_text
696061351995777025,2016-02-06 20:02:13,"Osculable, slonk, and 9 other amazing words we should all use more often: https://t.co/wDGsQ9AF5w https://t.co/WNkC3llS69"
696031142957469696,2016-02-06 18:02:10,Quiz: how well do you know Tolkien's etymologies? https://t.co/pvPduD6Nxo https://t.co/SfzKClsBQt
696000943121428480,2016-02-06 16:02:10,Have a look through 100 words that define the First World War: https://t.co/9hj3OzTlVW https://t.co/LWJApY3qlP
695970718744514560,2016-02-06 14:02:04,Have you ever wondered what the @OED Words of the Day would look like as images? Find out: https://t.co/B6UgG7EdL8 https://t.co/fhYr5V6fzU
695940397609172993,2016-02-06 12:01:35,Explore the toothy language of Buffy the Vampire Slayer: https://t.co/YRzNrhWflW https://t.co/NfUJxWgy8X
695910132702691328,2016-02-06 10:01:19,Grab yourself a cocktail and a flapper dress and discover 20 words from the 1920s: https://t.co/cIIGwMEpsA https://t.co/uSxpmgrGvD
695879861903233024,2016-02-06 08:01:02,Should you treat collective nouns as singular or plural? https://t.co/XEe4oEPcWz https://t.co/NHaslnFN06
695849593158922240,2016-02-06 06:00:45,"How I created the language of Game of Thrones, by @Dedalvs: https://t.co/HIMxuQG445 https://t.co/9FZqJChWn7"
695819418992041984,2016-02-06 04:00:51,"Curiosity might have killed the cat, but you'll be fine reading about cat idioms: https://t.co/S5yyfdNzHp https://t.co/v2mRiZYIWJ"
695789309249634304,2016-02-06 02:01:13,Love books? See how well you know the names of literary characters… https://t.co/PhEwh2EMgx https://t.co/4D3jNlfgVD
695763240161251330,2016-02-06 00:17:37,Word of the Day: dyslalia - inability to articulate comprehensible speech…... https://t.co/vaLAHl7f6e
695759094511222784,2016-02-06 00:01:09,Quiz yourself by seeing how well you know historical synonyms: https://t.co/3I6vvtzF5X https://t.co/9ZZtisawKv
695728946999095298,2016-02-05 22:01:21,Before you put pen to paper - here are 10 tips on how to improve your writing: https://t.co/hKYhSfuhx1 https://t.co/40IcSjBzhP
695698846958161924,2016-02-05 20:01:45,A is for apple… but where does the word come from? https://t.co/pmd5dsKaNr https://t.co/zhKwyrzl97
695638329023451136,2016-02-05 16:01:16,Going to the #RioCarnival? Here are 12 words you need to know: https://t.co/B4EasWMuI2 https://t.co/jbk7o1R0qG
695608102092148738,2016-02-05 14:01:09,Where do we get the names 'freshman' and 'sophomore'? https://t.co/mpkGInWcL7 https://t.co/TO2wDjn3a8
695577740863475712,2016-02-05 12:00:31,Take a dip into the Dictionary of American Regional English for some unusual terms: https://t.co/B37iSfdn7K https://t.co/RIsK0xf8vS
695577272997253120,2016-02-05 11:58:39,We feel you may also be wishing for a rabbit in a hat with a bat!? A very strange combination of things to desire. https://t.co/pzz7QCKNtg
695547812923187201,2016-02-05 10:01:35,Let's talk about 'baller'… https://t.co/UbHDUeC0og https://t.co/6HGu2bViVm
695517571777499136,2016-02-05 08:01:25,Does it matter if words have Greek AND Latin roots? https://t.co/VOEb8259g1 https://t.co/79T4R47HTB
695487230723358720,2016-02-05 06:00:51,Flashback to word of the year 2014: what is the origin of 'vape'? https://t.co/dS9A6cJyH4 https://t.co/yKN2ZcFMgH
695457054811676672,2016-02-05 04:00:57,Get in the spirit of Jack Kerouac and find out where 'beatnik' came from: https://t.co/FLHhY3O0SY https://t.co/A8H9QYka4H
695426930753966082,2016-02-05 02:01:15,What's the dope on 'dope'? https://t.co/aLoYMpgSWO https://t.co/sUsimzIZWG
695402278723846144,2016-02-05 00:23:17,Word of the Day: crepuscule - twilight... https://t.co/PYBTUuexLo
695396736294981634,2016-02-05 00:01:16,Take a look at synonyms and the Oxford English Corpus: https://t.co/W1vdmd4rIw https://t.co/CP5hw1HC7q
695366606197657601,2016-02-04 22:01:32,Facebook is 12 today - let's take a look at the impact it had on the English language: https://t.co/gr03haEHyj https://t.co/YAxwpbpSWH
695336483645837312,2016-02-04 20:01:51,10 unusual synonyms of 'chew' to chew over: https://t.co/sj4fDX5WUq https://t.co/b3LNbDe6qE
695306253732548609,2016-02-04 18:01:43,Explore different words for ‘friend’ around the world: https://t.co/2K0G0iqF71 #friendsday https://t.co/2brzsv5m9C
695292689781243904,2016-02-04 17:07:49,Why couldn't the grammar cat help scratching people? Because it had insubordinate claws. #grammarjokes
695277948795019264,2016-02-04 16:09:15,Enid Blyton is quoted many times in the @OED. Which words does she provide evidence for? https://t.co/YXqVbMDO53 https://t.co/QaKWvseRtM
695266831146303488,2016-02-04 15:25:04,@donatamaralewis You can use either in British English. There's more info about ize/ise endings in our blog: https://t.co/rOH229m25l
695257715787046912,2016-02-04 14:48:51,Love this one! #grammarjokes #spellingjokes https://t.co/8uyxHR0CTo
695245659990024192,2016-02-04 14:00:57,"Listen up, and explore Aretha Franklin's lyrics and the @OED: https://t.co/QArCCwp8re https://t.co/cGDePyRq8x"
695238216379691009,2016-02-04 13:31:22,You've made us laugh ourselves into a comma. https://t.co/PugxIS2CBo
695219006299619328,2016-02-04 12:15:02,Three intransitive verbs walk into a bar. They sit. They Drink. They Leave. #grammarjokes
695215356600827904,2016-02-04 12:00:32,Does 'ostracize' have anything to do with ostriches? https://t.co/39yjOq9ATY https://t.co/zMqF38yMYS
695212962785656832,2016-02-04 11:51:01,"RT @EconCulture: Bad language, blasphemy and taboos: our language columnist @LaneGreene on the power of words https://t.co/hFqy0tXViG"
695210275990020097,2016-02-04 11:40:20,RT @OUPAcademic: How English became English – and not Latin https://t.co/QggDW3mbnV By @SCPHorobin #language #education #linguistics
695210194771513344,2016-02-04 11:40:01,Nice! #grammarjokes #spellingjokes https://t.co/Tfrso08dkH
695192631085809664,2016-02-04 10:30:13,"Keep these coming, everyone! We love #grammarjokes and #spellingjokes more than we're willing to admit.  https://t.co/UauRZGpMTa"
695189389962567680,2016-02-04 10:17:21,"Haha! Well, you made us smile on a Thursday morning, so thanks! #grammarjokesarethebestjokes https://t.co/HsluPi6Rua"
695187758013399040,2016-02-04 10:10:52,@AnahRuiz1 'Latino' (or 'Latina') is used of a person of Latin American origin or descent: https://t.co/5wGFpXgAF3
695187189899071488,2016-02-04 10:08:36,@rdgresident But yes! https://t.co/CJ1Ph9S6jJ
695185417105186818,2016-02-04 10:01:34,"What does 'cracker-barrel' actually mean, and is it offensive? https://t.co/15bKM9VME3 https://t.co/uVx8cPZqO4"
695155151087235072,2016-02-04 08:01:18,"So, how many people actually speak Klingon? https://t.co/vcHUtVvV2Y https://t.co/BX7sA8zEdZ"
695124842169901058,2016-02-04 06:00:51,How did J R R Tolkien help with the @OED's entry for 'hobbit'? https://t.co/a00qKR8dds https://t.co/F2y3BBINy7
695064539193278464,2016-02-04 02:01:14,Should you bother learning Esperanto? https://t.co/pwOstWqJlY https://t.co/DbHkW7haAD
695040396993392640,2016-02-04 00:25:18,Word of the Day: monosemy - the property of having only one meaning... https://t.co/IF6qaMkaP9
695034330851196928,2016-02-04 00:01:12,What puts the Latin in Latin America? https://t.co/Y0ElHq9top https://t.co/OxujJIocwr
695004189064327168,2016-02-03 22:01:25,'Into' isn't the same as 'in to': here are the rules for picking the right one https://t.co/RdyacSvIpy https://t.co/f5UfUj5Sid
694974064578949123,2016-02-03 20:01:43,"Lost Generation, Beat Generation, Baby Boomers… where do we get these names? https://t.co/gPu55AXneb https://t.co/fYa0Tt3PX6"
694944198475255808,2016-02-03 18:03:03,Video: is a rabbit a rodent? https://t.co/5JBYFRK1cX https://t.co/8B4FNIoYOm
694913414808870913,2016-02-03 16:00:43,Explore the role the words 'nonapology' and 'apology tour' play in US politics today: https://t.co/EYcHUDEqhi https://t.co/sJhJFRvrEe
694883152511307776,2016-02-03 14:00:28,"In Japan, kotodama is the spirit of language: where does it come from and how does it work? https://t.co/zPq5meDeGH https://t.co/lpJyYtHuGg"
694852960598253568,2016-02-03 12:00:30,"If you speak English and Spanish, you might want to watch out for these false friends: https://t.co/ZjpcinvCtN https://t.co/jnyfdnSywu"
694825987868082176,2016-02-03 10:13:19,RT @mashedradish: Chucking out the “wood” in “woodchuck” https://t.co/XmgpwUo60O https://t.co/xquCA70SR7
694823092938489856,2016-02-03 10:01:49,Is English welcome in French - and can it be stopped? https://t.co/VnJ5UPG7ax https://t.co/zlhivhD3Jk
694820274932453376,2016-02-03 09:50:37,@TheSovietHotdog y'all is a contraction of you-all and it IS in the dictionary - look here: https://t.co/WdVRMjDpTl
694792806951456768,2016-02-03 08:01:28,"If you've ever been tempted to take up figure skating, here are 10 words you need to know: https://t.co/RCmEGkvwFs https://t.co/Fq265EWRUN"
694762488261402624,2016-02-03 06:00:59,Is Jersey Shore one of your guilty TV pleasures? Find out what they're talking about: https://t.co/ZtsSV3fvCy https://t.co/uqK61XAiLu
694732289352273920,2016-02-03 04:00:59,Does a swashbuckler swashbuckle? https://t.co/wk8RI9IYWd https://t.co/5bzpKsbpPa
694702183225376768,2016-02-03 02:01:22,Elicit or illicit? Make sure you know the difference: https://t.co/NwpOdK8bYT https://t.co/DkDwjgyLad
694677288038854656,2016-02-03 00:22:26,Word of the Day: wythe - a single thickness of bricks in masonry construction...... https://t.co/yea0KcWWEg
694671961704783877,2016-02-03 00:01:16,"Know any chatterboxes? From worder to prattle-box, here are some synonyms you can call them: https://t.co/i7IKHbZ9I3 https://t.co/lyG1QW5NmY"
694641839022940160,2016-02-02 22:01:34,"Who had the original sideburns, and where did they get their name? https://t.co/1IWSbzOv4n https://t.co/gVDyIZ9nq0"
694611721609203712,2016-02-02 20:01:54,"Smeigh, solert, or ept? Here are some historical synonyms for 'clever': https://t.co/W6vkxCvIFF https://t.co/e54lLZIPxm"
694581424259743745,2016-02-02 18:01:30,How new technologies are changing the face of libraries: https://t.co/EHc1c8rNBH #NationalLibrariesDay https://t.co/MYKc2gLD3O
694566158029197314,2016-02-02 17:00:51,"We can go one better than that, @luciekerley &amp; @_misswong: https://t.co/Z4VJ3rfRzz"
694551110367997952,2016-02-02 16:01:03,"Shrove Tuesday is next week - but what is it, and what has it got to do with pancakes? https://t.co/gTWSdg317O"
694520976520921088,2016-02-02 14:01:19,"Find out which words #JamesJoyce, born #OTD in 1882, contributed to the English language: https://t.co/dTwrTFHFeD https://t.co/iS7HUJrRjj"
694516571096637440,2016-02-02 13:43:48,@jean_pio_007 We're glad you enjoyed it! Great suggestion; we've updated the post accordingly.
694490593674858496,2016-02-02 12:00:35,"So, what actually is a caucus? https://t.co/LccGd93SmK #IowaCaucus https://t.co/JiFsQBWxhA"
694485482948927488,2016-02-02 11:40:16,. @DoctorChristian @tlnet_training @DprMassey @leoselivan We can confirm that 'your' is a possessive determiner: https://t.co/cxToCccTxJ
694460653185155072,2016-02-02 10:01:36,"Chips, fries, or crisps? Chip away at the differences between British and American English: https://t.co/XPQJjujvLW https://t.co/yZRXe4AwVZ"
694430379416141824,2016-02-02 08:01:19,Bon voyage! Learn how to say goodbye around the globe: https://t.co/1MQ7ee3diX https://t.co/LARR1WJeOg
694400075074781184,2016-02-02 06:00:53,"Today's #GroundhogDay, so let's explore some groundhog etymologies: https://t.co/ZOITmltRgp https://t.co/AzUalvZvGY"
694369880003448832,2016-02-02 04:00:54,Arrrr! It feels like time to learn how to talk like a pirate: https://t.co/pWvCKhWDCn https://t.co/vK9xu4FNkJ
694339722597023746,2016-02-02 02:01:04,What are the rules about using 'among' and 'between'? Discover in our blog post: https://t.co/WfeOMvdw9E https://t.co/nqJyt1Gxe5
694313738393030656,2016-02-02 00:17:49,Word of the Day: tazza - a shallow wine cup mounted on a foot…... https://t.co/lqnhnqPagh
694309550552399872,2016-02-02 00:01:11,Which Oxford World's Classic should you read next? Take our quiz and find out: https://t.co/LFP8S2XocH https://t.co/LrSlmOs6bF
694282921142849538,2016-02-01 22:15:22,@fi_dean Here you go https://t.co/2olKYYRBFY
694279436485685249,2016-02-01 22:01:31,A ladybird/ladybug isn't a lady or a bird. Explore the curious history of the insect's name: https://t.co/EzotNEy8NZ https://t.co/yrdsQEATSv
694249320435077120,2016-02-01 20:01:51,Our guest blogger Tim William Machan investigates the fusion of Norwegian English: https://t.co/yuZNQehmvH https://t.co/EtHcZaqbU8
694218897768194049,2016-02-01 18:00:57,"Swearing, arguing, and @realDonaldTrump’s made-up words: the language of the US Election https://t.co/IaKbCzRZ8r https://t.co/YPsUDgNmYc"
694188655032844289,2016-02-01 16:00:47,"Happy 132nd birthday, @OED! Here are 8 words which share the same birthdate: https://t.co/X80S4RC4yy https://t.co/WI0cIXxGU2"
694158477292347392,2016-02-01 14:00:52,Pow! How well do you know the language of comic books? https://t.co/OObdoZkI1Z https://t.co/mSKNXy7yN3
694128633896632320,2016-02-01 12:02:17,February is #LGBT History Month in the UK. Learn more about the lexicon of gender identity: https://t.co/WlKsTIcTwE https://t.co/M4NqhbEy9x
694122028417294336,2016-02-01 11:36:02,"RT @WSJ: Is the language barrier about to fall? Automatic translation tools set for rapid advances, writes @AlecJRoss https://t.co/47YI12wy…"
694121893478174720,2016-02-01 11:35:30,"RT @EconCulture: Should ""correct"" language be decided by authoritative rules, or actual usage? Answer—both https://t.co/ZBbQ2xylAn https://…"
694098305589100544,2016-02-01 10:01:46,'Accept' and 'except' aren't the same: make sure you know the difference. https://t.co/HJys0H2a1P https://t.co/dedTu96SIt
694096386296528896,2016-02-01 09:54:08,RT @thei100: Here are the most beautiful words in 12 different languages https://t.co/29rCKjQxnQ https://t.co/9hL02QzhO1
694068061129809920,2016-02-01 08:01:35,Do you know when to use 'mitigate' and when to use 'militate'? Our blog post sorts them out: https://t.co/uwuB1Zfiqf https://t.co/hyhEPbykgl
694037726597890048,2016-02-01 06:01:03,Help! Where did we get the terms SOS and Mayday? (We've got the answers.) https://t.co/wJfDmc8768 https://t.co/eNwb8TkSSk
694007497003245568,2016-02-01 04:00:55,Affect and effect can be tricky: quiz yourself to see how well you know the difference. https://t.co/DP4YnFQle1 https://t.co/nSDLuziIVV
693977372517875712,2016-02-01 02:01:13,When to use 'pedal' and when to use 'peddle'? Find out the answers in our blog post: https://t.co/u44n51LMeC https://t.co/A5qxX5J1KA
693953272013557761,2016-02-01 00:25:27,Word of the Day: lipogram - writing in which a letter is systematically omitted…... https://t.co/WQsN2HIHUc
693947186430787585,2016-02-01 00:01:16,Be careful what you say… did you know that these 9 terms had offensive origins? https://t.co/w8PzGPJHPQ https://t.co/6yqM3nXffs
693901937754923008,2016-01-31 21:01:28,Did you know that a baby eel is an elver? Find out the names of other baby animals: https://t.co/U8hhZNO8Rt https://t.co/RYnEmBOoBH
693856683009937408,2016-01-31 18:01:39,#Quote of the Week https://t.co/UKTlvF5pRA
693811424297127936,2016-01-31 15:01:48,What's the difference between empathy and sympathy? https://t.co/rRUuDKzdRL https://t.co/gatieBRTmX
693765994196635648,2016-01-31 12:01:17,#OEDTimelineChallenge: can you guess how old these words are? https://t.co/DMTU57sqoS https://t.co/0RQSyTIsAp
693720648082984961,2016-01-31 09:01:05,Do you know the language of ballet? Test yourself with our quiz: https://t.co/BbarXH471W https://t.co/tlMcS6HBHa
693675295178657792,2016-01-31 06:00:52,What is the origin of 'posh' and is it connected with ships? We have (some of) the answers: https://t.co/4ZWQ63WMOb https://t.co/aS1CDBd6v9
693630019063697408,2016-01-31 03:00:58,"Food named after people, from lamingtons to sandwiches: https://t.co/Cs7XAjTv8G https://t.co/6ZrFDqdcOF"
693588811142537216,2016-01-31 00:17:13,Word of the Day: bracero - a Mexican seasonal agricultural labourer in the US…... https://t.co/Hh9LniwhiI
693584763517542401,2016-01-31 00:01:08,How to get 'can' and 'could' right: https://t.co/C3v1reYzSy https://t.co/o3gdjGxpe3
693539637806157824,2016-01-30 21:01:49,What's the origin of the phrase ‘crocodile tears’? https://t.co/evicnx36EX https://t.co/yfoFsYL92a
693494483502112768,2016-01-30 18:02:24,Explore some horse idioms in English and other languages in our blog post: https://t.co/DkkDaD50zZ https://t.co/amHPri60bG
693449212634230784,2016-01-30 15:02:30,How much do you really know about where your vocabulary comes from? Take the quiz: https://t.co/GFJKAiTQsP https://t.co/6vULT3kPRU
693403715622039552,2016-01-30 12:01:43,How difficult is it really to learn a language as an adult? https://t.co/yynvtAzrHZ https://t.co/P8aiabVf7P
693358350629732352,2016-01-30 09:01:27,Do you know the longest word cited in the dictionary? https://t.co/itpKV4qUND https://t.co/U98wDyZLyi
693312936685768704,2016-01-30 06:00:59,"Calm down, calm down. Here are 9 pronunciation arguments that you can stop having. https://t.co/qzEoOKoQbs https://t.co/qJuBxWgnYI"
693267781844877313,2016-01-30 03:01:34,#BirthdayWordGenerator: which word originated in your birth year? https://t.co/4ZKYU6D0d1 https://t.co/SfC7FbvRkw
693226988878852096,2016-01-30 00:19:28,Word of the Day: chèvre - French cheese made with goat's milk... https://t.co/bollLjLrIO
693222594946977796,2016-01-30 00:02:00,"How well do you know German idioms? Here are extra sausages, tap-dancing bears, and more. https://t.co/0FQ8z8rGU5 https://t.co/ILvkL2mpCp"
693177472569991168,2016-01-29 21:02:42,What are some other forms of worship besides idolatry? https://t.co/HDccTidfEa https://t.co/C3VZfvx6lJ
693131810809712641,2016-01-29 18:01:16,Ensure or insure? Our video can help you out with this #confusable: https://t.co/Hq7ghgQLDy
693131764722745344,2016-01-29 18:01:05,"We say 'Tom, Dick, or Harry' in English: which placeholder names are used around the world? https://t.co/tfrlZDtYym https://t.co/Lj2uA7K7P3"
693041444383227906,2016-01-29 12:02:11,What’s the longest word with just one syllable? https://t.co/nNHi3DiHMb https://t.co/a9CY0TbnBD
693020216821813248,2016-01-29 10:37:50,@Princeluvshreya usually this means 'to be honest'.
693017484610441217,2016-01-29 10:26:58,@Princeluvshreya not suitable for work.
693015213801639936,2016-01-29 10:17:57,"RT @cheaty: You say JIF, I say GIF. JIF, GIF, JIF, GIF. Let's call the whole thing off. Thx, @OxfordWords! 🍅 (PS: It's GIF) https://t.co/QQ…"
693014205344169984,2016-01-29 10:13:56,Perhaps we should mark them 'NSFW'? https://t.co/U38R5BvL0c
693008998749114368,2016-01-29 09:53:15,"@cheaty @liannegeorge @stevemaich Lianne, you're not on your own! https://t.co/94TUOnk0it"
692999376755625984,2016-01-29 09:15:01,"@freeman999 Thanks, Lee. You shouldn't be seeing those anymore now."
692996001452396545,2016-01-29 09:01:36,Find out which Charles Dickens character you are: https://t.co/6V1BTAY8z8 https://t.co/bVEZ7Z9SEZ
692950572597641216,2016-01-29 06:01:05,Alot or a lot? Along or a long? We explore when to split and when not to split. https://t.co/R9fhKjtPbh https://t.co/kBvhE567j6
692905339071651840,2016-01-29 03:01:21,What should you call your baby? Try the baby name generator: https://t.co/c1ngs19htf https://t.co/6yh9p0gOrC
692865664495673348,2016-01-29 00:23:41,Word of the Day: cueca - a lively South American dance... https://t.co/MUBhCYoDBL
692860130606514181,2016-01-29 00:01:42,"What is a double negative, and is it OK to use them? https://t.co/kVL2RnIR7L https://t.co/whc0PQM2wd"
692815047878447105,2016-01-28 21:02:33,"Are split infinitives wrong? Here are grammar myths you learned at school, debunked: https://t.co/UEdO09XN9G https://t.co/5iDJyv4nJw"
692769262549745664,2016-01-28 18:00:37,Do you ‘wreak havoc’ or ‘wreck havoc’? https://t.co/6IqxPznDoi https://t.co/o5L0b2Wthb
692723942910459904,2016-01-28 15:00:32,Have you got the skills to beat a 7 year old in a grammar test? https://t.co/oJetZwdrxT https://t.co/YaMLfVdrUU
692688182769537028,2016-01-28 12:38:26,RT @missnthompsonY3: We're just sitting here using dictionaries independently.... @OxfordWords #independent-learners #proudteacher https://…
692679024192135172,2016-01-28 12:02:03,Did you know that a baby rabbit is called a 'kitten'? Discover other baby animal names: https://t.co/dynpZopmb9 https://t.co/KXDXfuPW9b
692633608117293056,2016-01-28 09:01:35,Find out which Jane Austen heroine you are: https://t.co/yoxfS821k6 https://t.co/n0zGSIjjl4
692588179115868160,2016-01-28 06:01:04,Why isn't 'sheeps' the plural of 'sheep'… and what about minotaurs? https://t.co/s6VHb4c86D https://t.co/AuOtzgwIrU
692542964908834816,2016-01-28 03:01:24,Is it true that you cannot end a sentence with a preposition? https://t.co/Gw8xrz37Cv https://t.co/9AhXyUQinU
692501971958435841,2016-01-28 00:18:30,Word of the Day: parhelion - a bright spot appearing by the sun…... https://t.co/tlXANKEW0B
692497733521952770,2016-01-28 00:01:40,What’s the difference in meaning between imply and infer? https://t.co/xiHja6WUNd https://t.co/cCcTh4CXqN
692452580660740096,2016-01-27 21:02:15,What kind of mark have @BeastieBoys lyrics made on the English language? https://t.co/syU07KcJcj https://t.co/cdErYh0YYW
692406919022166016,2016-01-27 18:00:48,How good is your Indian English? Take our quiz and let us know: https://t.co/RjQaicAyM9 https://t.co/gFjHLoEhkG
692376709585309696,2016-01-27 16:00:45,"RT @OUPAcademic: In 1582, English was used only by around 7 million, by the 21st c. 450 million spoke it worldwide https://t.co/C50cZeAU8d …"
692358219952492545,2016-01-27 14:47:17,RT @Multi_Ling_Mat: Number of people learning a second #language by country https://t.co/iU8RXCnzw8 #Europe
692316634598526976,2016-01-27 12:02:02,Explore the portmanteau in Alice’s Adventures in Wonderland: https://t.co/okMuWrJW78 https://t.co/mqQfxwqj5e
692271149519126529,2016-01-27 09:01:18,Learn the differences between 'lie' and 'lay': https://t.co/9vrWer8Nux https://t.co/REG5EuRrbe
692225731741507584,2016-01-27 06:00:50,Why do our swear words sound German? We look at curse words and the history of English. https://t.co/Z2z4LSwa3v https://t.co/m1xhaHJHY8
692180519245717504,2016-01-27 03:01:10,Ever wondered how Shakespearean your writing is? Now you have the chance to find out: https://t.co/3PGC8MHXXi https://t.co/IlNwylO2f2
692140000285212675,2016-01-27 00:20:10,Word of the Day: kore - an ancient Greek statue of a young woman…... https://t.co/xPOHc4WgEc
692135271534567426,2016-01-27 00:01:22,Did you know there are words which describe the fear of idleness and even body odour? https://t.co/yAsgyR5Bxj https://t.co/eyP37HANFZ
692090018886782976,2016-01-26 21:01:33,Australian animal words: do you know your salties from your roos? #AustraliaDay https://t.co/0A94Lmth8v https://t.co/0iHRX19eIB
692044752376709121,2016-01-26 18:01:41,How well do you know Shakespearean quotations about money? Take our quiz and find out… https://t.co/9pXyB1xNcs https://t.co/Os6pHQTItm
692001434355798016,2016-01-26 15:09:33,RT @cbcradio: #SpeakGwichinToMe: Using social media to reclaim language https://t.co/oqOuMf8Z6S https://t.co/Oy2xz79xCp
691999231591239680,2016-01-26 15:00:48,Our example sentences and the task of selecting them explained: https://t.co/7uKY6tnmku https://t.co/TKW9rsAhiF
691964754068389888,2016-01-26 12:43:48,RT @qz: The untranslatable Scandinavian words for coziness describe a very particular winter joy https://t.co/vYBa83bX8o
691959884888326144,2016-01-26 12:24:27,RT @TEDTalks: How language can affect the way we think: https://t.co/sKiiX3q4nE https://t.co/9o9NYHVghn
691953886014377984,2016-01-26 12:00:36,#AustraliaDay: how well do you know the language spoken down under? https://t.co/HHtfsfg0Up https://t.co/3pcWJkD7Pm
691941270487330816,2016-01-26 11:10:29,RT @BBC_Culture: Australian slang has influenced the English language around the world: https://t.co/sLYzozZcMK #AustraliaDay https://t.co/…
691922656128557056,2016-01-26 09:56:31,"@AvantikaSeeth It's a great word, isn't it? Perhaps tricky to work into everyday conversation, but we're willing to give it a go."
691908751297789952,2016-01-26 09:01:16,Why we should use the plural pronoun 'they' instead of 'he or she': https://t.co/efKphBOgM9
691863337689333761,2016-01-26 06:00:48,"Tired of the word 'weird'? Here are 17 alternatives, from 'ostrobogulous' to 'zonky'.
https://t.co/DMnaL79d8p https://t.co/Kp5h0kCNiP"
691818076413804544,2016-01-26 03:00:57,Discover the language of #GameOfThrones: https://t.co/H4UMKcBQAE https://t.co/apYzsR2Jhl
691777061464227841,2016-01-26 00:17:58,Word of the Day: banausic - not operating on an elevated level; mundane... https://t.co/81dTeeyuzF
691772797438263297,2016-01-26 00:01:02,"It's #AustraliaDay, so let's take a look at the word 'kangaroo': https://t.co/Z58dKtWrhu https://t.co/YDe39dNr4l"
691727558728159232,2016-01-25 21:01:16,The language of the #BurnsSupper: https://t.co/5ei4BpBWPE https://t.co/lpp7eS7nyx
691682230909980676,2016-01-25 18:01:09,Is a yam a sweet potato? Our video has the answers: https://t.co/NUIMfVRucr
691636750884704256,2016-01-25 15:00:26,Celebrate #VirginiaWoolf's birthday with 5 beautiful quotations: https://t.co/uM0RX1ZIo8 https://t.co/7fDZnb0tiq
691625839276986369,2016-01-25 14:17:04,@MrsPsays You're very welcome!
691614901735919617,2016-01-25 13:33:36,"@MrsPsays Some still don't like it, but that use of 'literally' has been around for a very long time - and it can't be called 'wrong'."
691591504813490177,2016-01-25 12:00:38,What impact did Virginia Woolf have on the English language? https://t.co/pmrfgT1bLo https://t.co/Jck5u9wJs2
691570427102109696,2016-01-25 10:36:53,RT @InterestingLit: What Lewis Carroll's 'Jabberwocky' teaches us about language and creativity: https://t.co/0h1982KOo8 https://t.co/Ygr5i…
