id_tweet,created_at,tweet_text
710722629263605760,2016-03-18 07:00:54,Where does the idea of the 'white elephant' come from? https://t.co/DfIBQ2wgbx https://t.co/5iL9ERg5Bz
710707484428791808,2016-03-18 06:00:43,How did 'pleb' and 'snob' come to be derogatory terms and which one is more offensive? https://t.co/DZCf2wmtZw https://t.co/sspGtaVSVP
710692378462568449,2016-03-18 05:00:41,Ana Frankenberg-Garcia explains why you’d better not ‘shake hands’ in Portuguese: https://t.co/aCfaNdCN7h https://t.co/n39Xu3GNvF
710677281904136193,2016-03-18 04:00:42,The many Bs of Beyoncé: https://t.co/Pkq95E5ndg https://t.co/Lqw1HykoZi
710662203259666432,2016-03-18 03:00:47,Can you tell which quotation is from Dylan Thomas and which belongs to Bob Dylan? https://t.co/7NUp0NZjSD https://t.co/lGNIa96AOw
710647120613806080,2016-03-18 02:00:51,Quiz: French words no longer used in French https://t.co/CEp3FhkzK9 https://t.co/4HJ6cKHHBy
710632073871097856,2016-03-18 01:01:03,Expressions involving the word 'light' in English and other languages: https://t.co/ebpGdwLQOn https://t.co/Q7hZP8zE53
710622116438265860,2016-03-18 00:21:29,Word of the Day: entity - a thing with distinct and independent existence... https://t.co/btfDZXkNwK
710616940155379712,2016-03-18 00:00:55,Which fashion words have defined the 20th century? https://t.co/BnfcYdoWss https://t.co/ggwvBs4x2d
710601850878357505,2016-03-17 23:00:58,What's the difference between nerds and geeks? https://t.co/zYRMR8urfS https://t.co/34Stpdycxa
710586809361813504,2016-03-17 22:01:12,'Brainiac' and other words that originated in a Superman comic: https://t.co/R6emrupxBF https://t.co/lSZ4QA3Ueb
710571705534648320,2016-03-17 21:01:11,Can you match the archaic or obsolete animal term with its modern day equivalent? https://t.co/5LURM5roJ6 https://t.co/KWN1CwXGrI
710556624902078464,2016-03-17 20:01:15,How much has the vocabulary of English changed since Abraham Lincoln’s presidency? https://t.co/BtA2ysA0lZ https://t.co/otAkAdJCHX
710541573830909952,2016-03-17 19:01:27,Where does the expression ‘the bee’s knees’ come from? https://t.co/57qKyFeWLt https://t.co/FzghciG40u
710526422524305408,2016-03-17 18:01:14,Explore the elusive origin of the word 'posh': https://t.co/3D2WvRSIze https://t.co/JRLuBq1q6t
710511348187316224,2016-03-17 17:01:20,Guest blogger @ClerkofOxford finds words of wisdom in Old English: https://t.co/RVSG5UmKjX https://t.co/198cKcO9CB
710496253562527749,2016-03-17 16:01:21,Bare or bear? Make sure you know which one to use by watching this video: https://t.co/62oyo7r7UM https://t.co/SSdcYyInC4
710480995171098624,2016-03-17 15:00:44,Here are 15 words from Irish English you need to know for #StPatricksDay: https://t.co/kvpz7Z2dGK https://t.co/VnhpGxtgxy
710465917281554433,2016-03-17 14:00:49,"For all you wordsters out there, here's a list of words beginning with 'word': https://t.co/kaQa0UONfz https://t.co/YO0CN2Ojju"
710450806579970048,2016-03-17 13:00:46,Are you a 'spinner of yarns'? Here are 9 original ways to call someone a liar: https://t.co/wR1Mi2WU36 https://t.co/sFzLIAwfrX
710435638823272448,2016-03-17 12:00:30,"Vlogging, celebrity gossip, and gotcha journalism: explore the new words in the @OED https://t.co/L2yci2Easl https://t.co/fWJhD5SS4m"
710420505296289792,2016-03-17 11:00:22,Peter Pan collars and other objects named after book titles or characters: https://t.co/FiS0gumyHp https://t.co/gdFhk275SS
710406913352142851,2016-03-17 10:06:21,RT @susie_dent: 'Broadcast' first meant the widespread scattering of seeds rather than radio signals. And the 'aftermath' was the new grass…
710405636861894657,2016-03-17 10:01:17,If something is 'lacertiform' it resembles a lizard. Discover more unusual terms for shapes: https://t.co/w2nykAYyxb https://t.co/H9BHOQPAyR
710390486016643073,2016-03-17 09:01:04,Think you've got the luck o’ the Irish? Take our #StPatricksDay quiz: https://t.co/hk5Ly0CX3g https://t.co/7TJyCKnxEX
710375383867203584,2016-03-17 08:01:04,Discover the long history of elephants in the English language: https://t.co/yQslkl4Aps https://t.co/xmtdttana3
710360227493900288,2016-03-17 07:00:50,"If you’ve got it, flaunt it! Or is it 'flout it'? Find out how to get it right: https://t.co/waRT6jw991 https://t.co/cR7LChxUBo"
710345105811578880,2016-03-17 06:00:45,What do elections have to do with pebbles? @lornashaddick takes a look at election etymology https://t.co/hVZK3LCaeT https://t.co/d8Ai9NpNuA
710329991465144320,2016-03-17 05:00:41,Horse-racing has contributed many well-known expressions to English. Here are some of them: https://t.co/TbCv7x53O2 https://t.co/mJXHayEriJ
710314891912028160,2016-03-17 04:00:41,How well do you know the vocabulary of handwriting? https://t.co/vgAO5HYoDE https://t.co/XC5Del1Pl5
710299844481396736,2016-03-17 03:00:54,Explore the language of snooker: https://t.co/LXP0dhqCIx https://t.co/TxEWLfHzCg
710284754415980548,2016-03-17 02:00:56,Ay caramba! Find out how The Simpsons left their mark on the English language: https://t.co/NBnoepn6ba https://t.co/FKZkQFntuC
710269686970228736,2016-03-17 01:01:04,Whet your appetite with this list of popular baking idioms in English: https://t.co/CwHUgMzwEl https://t.co/dPo32qOanb
710259545717743618,2016-03-17 00:20:46,Word of the Day: Kaddish - an ancient Jewish prayer sequence…... https://t.co/ejebPsygpt
710254608044728321,2016-03-17 00:01:09,Test your knowledge of standard English usage and grammar: https://t.co/FFSV6VMkXt https://t.co/56CEwg3oon
710239481341878272,2016-03-16 23:01:02,Discover how various languages use rain as a metaphor in idioms: https://t.co/xuRaX7fgX1 https://t.co/Srkerkknxe
710224428043538433,2016-03-16 22:01:13,How much do you know about constructed languages? Take the quiz: https://t.co/ukTT0W8zaE https://t.co/0ZJ6lHGEhv
710209334488276992,2016-03-16 21:01:15,How well do Oxford Dictionaries staff know tennis terms? Find out in our video: https://t.co/kt7a4cAKdM https://t.co/jcbXKF1X4H
710194266442768384,2016-03-16 20:01:22,Can you match the film with the book? https://t.co/nRBMXd4myQ https://t.co/xKhx5l3m32
710179210099351552,2016-03-16 19:01:32,"How did the dollar, pound, and other currencies get their names? https://t.co/wxNle6Fwsc https://t.co/XhplXHYD11"
710163934309969921,2016-03-16 18:00:50,Today's @OED Word of the Day illustrated by Imogen Foxell. https://t.co/6Tz6KYLOj8
710148941405396992,2016-03-16 17:01:16,"Omnishambles, mind-meld, and other words that gained fame on TV shows: https://t.co/66Pf4t8CrR https://t.co/zii57cgh1r"
710133846218575872,2016-03-16 16:01:17,Find out how Tolkien created an old English fairy tale in The Hobbit: https://t.co/zNkUw6BQp4 https://t.co/kCGtSk8akI
710118566650122240,2016-03-16 15:00:34,What is a mnemonic? Find out and see some examples in our video: https://t.co/vSI0p8iTev https://t.co/ZIzibpXChZ
710103548877524992,2016-03-16 14:00:53,Explore the use of 'ghost' in hip-hop lyrics: https://t.co/Atihz7q6QI https://t.co/vR9qAjKIBS
710088438586982401,2016-03-16 13:00:51,Inverted meanings: how did 'bad' and 'wicked' become terms of approval? https://t.co/PGPcAXtQmx https://t.co/JI4ekMUKDE
710073499046567938,2016-03-16 12:01:29,How large was Shakespeare’s vocabulary and which words did he coin? https://t.co/uy27FxW8cS https://t.co/4m7vt2rM8u
710058345302990848,2016-03-16 11:01:16,Has 'snuck' erroneously snuck into our language or is it a real word? https://t.co/iIh4tJLkCp https://t.co/puyqqqWsZj
710043269556789248,2016-03-16 10:01:22,English is filled with a wild assortment of romantic endearments: https://t.co/l5adurrMji https://t.co/P8yyzBXJzS
710028136075890688,2016-03-16 09:01:13,Do you know what a 'subfusc' is? Explore the language of Oxford: https://t.co/vSDCivcvRc https://t.co/zjkVYqk3hf
710012960106795008,2016-03-16 08:00:55,"From eco-minded to ecopoiesis, explore a world of words: https://t.co/HIznohvxEI https://t.co/ijBTVTBTRu"
709997838034403329,2016-03-16 07:00:50,How has Facebook changed the English language? https://t.co/gr03haWiWT https://t.co/Erh2eIYhym
709982723658682368,2016-03-16 06:00:46,Find out why English sounds all Greek to you: https://t.co/MczsBgRQdV https://t.co/NukoVU0AvF
709967606204260352,2016-03-16 05:00:42,Explore the inventive words and worlds of Edgar Allan Poe and H.P. Lovecraft: https://t.co/YPswjZSGe0 https://t.co/OlF1ggF9ym
709952517136883713,2016-03-16 04:00:45,Can you work out which of these language-related @OED facts are true and which are false? https://t.co/6lsGWMH6DY https://t.co/aeIh7xwFcn
709937430812626944,2016-03-16 03:00:48,Explore the history of the word 'kangaroo': https://t.co/Z58dKtWrhu https://t.co/laS9jau4Vc
709922355838115840,2016-03-16 02:00:54,The word 'meme' has a curious history that is worth exploring… https://t.co/I6goPnN2Ev https://t.co/vA04ghfOPh
709907289470345220,2016-03-16 01:01:01,Ever eaten a parmo? The @OED is trying to trace older examples of the word: https://t.co/oDs9XmpMAz https://t.co/aym5mzUqTR
709896939886796801,2016-03-16 00:19:54,Word of the Day: biryani - an Indian dish made with highly seasoned rice…... https://t.co/Xh7f0PjtGS
709892216572006402,2016-03-16 00:01:08,Discover how diarists feature in the @OED: https://t.co/At0cOG5jYz https://t.co/Uy7rUMsQO3
709877092385689600,2016-03-15 23:01:02,What's the origin of the expression the #IdesOfMarch? https://t.co/DLaLInGhwo https://t.co/Hx0ljvHkwT
709862025665454080,2016-03-15 22:01:10,"From father-waur to patrizate, the forgotten language of fathers: https://t.co/MrqCWb205D https://t.co/LuKrnoQocf"
709846917140844547,2016-03-15 21:01:08,"How old is the word 'newspaper', and how long will it survive? https://t.co/NiAyPdIdJm https://t.co/IVtUfD8rTE"
709831856468926464,2016-03-15 20:01:17,"Hacker? Yes, I'm one of those. https://t.co/1WwXUDpZfe https://t.co/TPntYfo9kF"
709816792055685120,2016-03-15 19:01:25,An introduction to the confusing world of acronyms and initialisms: https://t.co/FKpVAC5e9d https://t.co/UfM9e51o4M
709801654481240064,2016-03-15 18:01:16,'The @OED: a great read in alphabetical order and otherwise' via @LAReviewofBooks: https://t.co/nBXFBgEYUn https://t.co/yapHG7F0qv
709788209614557184,2016-03-15 17:07:51,RT @HuffPostBooks: Breaking: Teens are not killing the English language: https://t.co/9a04pc9VyH #SmallBizWorks via @maddiecrum https://t.c…
709786575044009985,2016-03-15 17:01:21,How can a single word change someone's life? https://t.co/mVcc8Te7sC https://t.co/taZ7UwE3iL
709771481933357056,2016-03-15 16:01:22,"Sesquipedalian ruminations (or, thinking about long words): https://t.co/vz520Ext9E https://t.co/nouJSLULdA"
709756184073510912,2016-03-15 15:00:35,How good is your Northern Irish English? Test yourself: https://t.co/FgSlGifTdI https://t.co/HKq09AN1VQ
709746499157106689,2016-03-15 14:22:06,"In which we answer @khloekardashian's question 'If a word is misspelled in the dictionary, how will anyone know?'  https://t.co/6HuKHH2bRe"
709741176673460224,2016-03-15 14:00:57,What's the connection between Moby Dick and dictionaries? Find out… https://t.co/RveZ73Jq8z https://t.co/kfRtNqgbsX
709727058121920512,2016-03-15 13:04:51,RT @EconCulture: Why do writers abandon their native language? https://t.co/jef7d36p7m https://t.co/0hdUPiv6vg
709726038700531713,2016-03-15 13:00:48,"5 delightful, wonderful things you can do with the Historical Thesaurus of the @OED: https://t.co/Vl3pziVNLT https://t.co/sixdQypylf"
709711170987565056,2016-03-15 12:01:43,If you've wondered what the #IdesOfMarch are watch this video to find out: https://t.co/gjjZglvdSe https://t.co/kUCPuGbt3v
709696000781373441,2016-03-15 11:01:26,Take a linguistic walk through the language of comfort food. https://t.co/lXAykCCopq https://t.co/Qju9QsvOd3
709680882853015552,2016-03-15 10:01:22,"A linguistic tribute to everybody's favourite Vivienne, @FollowWestwood. https://t.co/Y6Vb61h2xu https://t.co/0VSPQDNGTV"
709665715977129984,2016-03-15 09:01:06,How has 'mother' been used in compound nouns over recent years? https://t.co/oZHJsYkmfn https://t.co/PZfLZ9DPHZ
709650591346245632,2016-03-15 08:01:00,"Find out the names of rulers past and present, from aga to viceroy. https://t.co/1PXtc4MzFU https://t.co/jTHKnFOAC0"
709635499045081088,2016-03-15 07:01:02,Samuel Taylor Coleridge was a noted poet - and an exuberant wordsmith. https://t.co/V8POuHJ3bG https://t.co/tyDnGJ3TPB
709620335340089344,2016-03-15 06:00:46,The vocabulary of surfing is probably longer and more complex than you'd anticipate… https://t.co/gPEYM01uD8 https://t.co/MSBxsGz3wo
709605216711213056,2016-03-15 05:00:42,Explore the many contributions of Elizabeth Barrett Browning to the @OED. https://t.co/eBcKiRyz9d https://t.co/e7jUbUvWu4
709590112816992256,2016-03-15 04:00:41,The @OED has always asked for the public's help: here's a history of the OED Appeals. https://t.co/vEtGQkUgwX https://t.co/pfk1efsdQM
709575040333967361,2016-03-15 03:00:47,Popular music genres keep blending - and we need new words to help. https://t.co/1RlmczMLSA https://t.co/EqMZfaiB6I
709559962918375424,2016-03-15 02:00:52,Enjoy some notable quotations from royals past and present. https://t.co/jIxDCX5CSk https://t.co/DHDXHYDfsw
709544884298977280,2016-03-15 01:00:57,Drink up: it's time to explore the language of cocktails. https://t.co/C49UMFpaxA https://t.co/KkNjmcwDKL
709534550922305537,2016-03-15 00:19:54,Word of the Day: floatel - a floating hotel…... https://t.co/xOHvyiGgdk
709529817948020736,2016-03-15 00:01:05,Which word unites cricket and politics? https://t.co/3B8NLbCKH5 https://t.co/TYDo0jGr4Z
709514734563778560,2016-03-14 23:01:09,Dog-lovers unite: we look at the many manifestations of the word 'dog'. https://t.co/OdnYI9GZ4d https://t.co/76oq6QpjTD
709484560170524672,2016-03-14 21:01:15,"You've probably heard the rule 'i before e except after c', but does it hold up to examination? https://t.co/4xJ22YCavO"
709469538002321409,2016-03-14 20:01:33,We think 'numpty' is probably older than 1988: can you help provide evidence? https://t.co/tybPcueMkm https://t.co/yDi7IXmjkz
709454428517109760,2016-03-14 19:01:31,Learn the word 'red' in various languages around the world. https://t.co/I1qnMrPEDm https://t.co/445sdT3fRd
709439219832377344,2016-03-14 18:01:05,Let’s see how well you know your cookie language: https://t.co/egNvjFbVwu https://t.co/tu8zwk9It6
709424218115612673,2016-03-14 17:01:28,TWO Winston Churchills? Afraid so… https://t.co/h8qjvYatle https://t.co/o4muft5rsA
709423200078266368,2016-03-14 16:57:26,RT @OUPAcademic: New frontiers in evolutionary linguistics https://t.co/DSHxAAqOxU Via @OxfordJournals #language #linguistics
709409123616563200,2016-03-14 16:01:29,Enjoy the language of William Wordsworth in our blog post: https://t.co/3VNMY4v7yO https://t.co/aPLeb4RHNd
709393552791498752,2016-03-14 14:59:37,Pi isn't the only number with a more specific name: https://t.co/x65gXuGhui #PiDay https://t.co/tLBjUcHeRL
709378804343562241,2016-03-14 14:01:01,Is 'glissando' a word musicians should be using? https://t.co/aasjcgHv7g https://t.co/dmpSRGlYWZ
709372515940966402,2016-03-14 13:36:01,@sushitransfer That's Rothenburg ob der Tauber in Bavaria: https://t.co/Jyod09fD1b
709363665636556801,2016-03-14 13:00:51,"Menacing, intimidating, and threatening: an exploration of three similar words. https://t.co/SAzmNGpfs5 https://t.co/w8iV8mU29P"
709348515844067328,2016-03-14 12:00:39,When is a Prime Minister in your teacup? https://t.co/SCIVHykIDq https://t.co/tJHU7ofKRi
709333374616219649,2016-03-14 11:00:29,Reverting back: a lesson in tautology. https://t.co/n1DGzba4ry https://t.co/191rABz6im
709318616404115456,2016-03-14 10:01:51,"For #PiDay, explore the world of homonyms, homographs, and homophones. https://t.co/9Wivbl50kG https://t.co/ALMMAqvlTK"
709303428900589568,2016-03-14 09:01:30,Explore the quirky language of Internet users. https://t.co/srSRySwT6M https://t.co/Vo5e2uWZqL
709288298770997248,2016-03-14 08:01:23,#DidYouKnow that @OED Editor James Murray's beard once froze solid? https://t.co/9hEOybid4U https://t.co/J8hxqnGTiv
709273138148872195,2016-03-14 07:01:08,Life in Washington D.C. comes with it own language: we translate. https://t.co/N7RvvmnBgx https://t.co/m4yUk6KqGG
709257968982712321,2016-03-14 06:00:51,What can the Hanging Gardens of Babylon tell us about language? https://t.co/axFqyI7WuJ https://t.co/74fZgTltye
709242849754259456,2016-03-14 05:00:47,What's the difference between a suffragette and a suffragist? https://t.co/Uf31YMvYTP https://t.co/fd2bNZFDuh
709227824356442112,2016-03-14 04:01:04,Angela Carter said she loved overwriting; which unusual words did she work into her writing? https://t.co/ZORNY7zaMm https://t.co/ZJY4hoPCBf
709212684303081472,2016-03-14 03:00:55,"Compound nouns, loanwords, and a rude word for coffee… exploring German. https://t.co/uJicTAUCFX https://t.co/hwRsr8eiLv"
709197599887257600,2016-03-14 02:00:58,Play ball! Let's take a look at the language of baseball. https://t.co/EAEdMT1cjP https://t.co/ePmEjVEu64
709182526053556224,2016-03-14 01:01:04,What is 'Bunburying' and which author do we have to thank for it?  https://t.co/42n05HdYU6 https://t.co/Oo1aXpU30s
709171763259826176,2016-03-14 00:18:18,Word of the Day: juba - a dance originating among plantation slaves…... https://t.co/5Qz2OPfJqh
709167464840601601,2016-03-14 00:01:13,The prefix 'auto-' has an involved and evolving history… https://t.co/1fyF9xvtaF https://t.co/vxssdEh3YJ
709152350087335936,2016-03-13 23:01:10,"SOCO is a 'scene-of-crime officer', but can you help the OED find examples from before 1977? https://t.co/KgScSC0vdM https://t.co/SsA3MauSxS"
709137274206883840,2016-03-13 22:01:15,Studying Portuguese in São Paulo: available in English and Portuguese. https://t.co/gubmazhz2H https://t.co/GE0VE6kmBh
709122184145477632,2016-03-13 21:01:18,What is journalese? Guest blogger @lornashaddick investigates: https://t.co/mRygsr0xfc https://t.co/5qKeL9r1FH
709107140972179457,2016-03-13 20:01:31,Take a closer look at the lanagueg of beloved songwriter Cole Porter: https://t.co/fcdV2PcHht https://t.co/mAmo4Ogy6m
709092050508115968,2016-03-13 19:01:33,Why are dictionaries called dictionaries? https://t.co/DVBDWOGeI7 https://t.co/UDRZMWsIYm
709076922035212288,2016-03-13 18:01:26,#Quote of the Week https://t.co/9Z5vr1qA5V
709061871375142912,2016-03-13 17:01:38,For #GeorgetteHeyer addicts: we've jumped into the @OED to find where she's left her mark. https://t.co/kw07nPWORK https://t.co/x090xLyxkF
709046778751012865,2016-03-13 16:01:40,How did director extraordinaire Alfred Hitchcock influence the English language? https://t.co/eCsmi9XopD https://t.co/jHrmpS7RMl
709031654325657600,2016-03-13 15:01:34,Let's take an etymological tour of the US... https://t.co/QkC6eubRo3 https://t.co/ypyZAC2aBw
709016554197950464,2016-03-13 14:01:34,Why do certain English words fall out of fashion? We explore… https://t.co/4GVt8dtUAz https://t.co/0MlgY15Vp9
709001467865260033,2016-03-13 13:01:37,Discover quotations for every occasion… https://t.co/UhvPrirnpb https://t.co/caULKYKq3J
708986283289346048,2016-03-13 12:01:16,Can you help the @OED find earlier evidence for the term 'jolly hockey sticks'? https://t.co/Q4WnhykLxp https://t.co/gk7W1opXa8
708971182519885824,2016-03-13 11:01:16,The big debate: what should we call librarians on Tumblr (besides fantastic)? https://t.co/NIkb2qIJ6E https://t.co/3NQzkxfjMy
708956032991629312,2016-03-13 10:01:04,"Baseball is one of the oldest US sports, so touch base with some of its language: https://t.co/mgqn8TxwU4 https://t.co/ILgWFiHmoJ"
708940919907753984,2016-03-13 09:01:01,"Catch-22, Stepford Wives, and Sherlock: how have novels added to the English language? https://t.co/T5uVTWJHlc https://t.co/oAoAj1ULdg"
708925793783693312,2016-03-13 08:00:55,From acre to Zeus: explore the words that have their roots in Sanskrit. https://t.co/shczl8Z6H0 https://t.co/rfR1WeOAgO
708910695539187713,2016-03-13 07:00:55,The 1920s was the crossword decade: how did it enter language and public consciousness? https://t.co/gajzZ5GCZf https://t.co/bClmtoH04B
708895562750361601,2016-03-13 06:00:47,The novelist Vita Sackville-West appears in a somewhat surprising @OED entry… https://t.co/56nFYMgPCW https://t.co/KAprpIf56v
708880460139601920,2016-03-13 05:00:46,Each pig gets its St Martin? Explore pig idioms in English and around Europe. https://t.co/DhtZeR9vSk https://t.co/SQQnw0eFgn
708865357210066944,2016-03-13 04:00:45,Let's take a look at the language of Tchaikovsky's The Nutcracker? https://t.co/QilyJ7SoQT https://t.co/Q2BSvqN6b7
708850282407526401,2016-03-13 03:00:51,"What does 'ice' mean in hip-hop, and what is its history? https://t.co/1hWRYUD4Ho https://t.co/LPJTbBcoDO"
708835231890055168,2016-03-13 02:01:03,How does the word 'nacho' help us think about nationality? https://t.co/Cg5GPiIrOH https://t.co/eDO2iyM9Xx
708820167120257024,2016-03-13 01:01:11,How does James Bond help lexicographers? https://t.co/TxzXW1PuaB https://t.co/k5sYfEkzKH
708812551908409344,2016-03-13 00:30:56,Word of the Day: fabliau - a bawdily humorous metrical tale…... https://t.co/TqtCSSYmTr
708805055525289984,2016-03-13 00:01:08,Howzat! Do you know everything there is to know about the language of cricket? https://t.co/xsWoL81rHC https://t.co/yBfrrBxLAP
708789967296847873,2016-03-12 23:01:11,Can you remember the names for all the different types of cloud? https://t.co/JatqVkBBUt https://t.co/whJO9MCU5s
708774883887616000,2016-03-12 22:01:15,"Hopefully, thankfully, and other thorny issues: https://t.co/vNGmmQphwB https://t.co/nJWgoIdyea"
708759840164806656,2016-03-12 21:01:28,Can you help the @OED find earlier evidence of the acronym 'FLOTUS'? https://t.co/vYnjRNnzdz https://t.co/KgqmeHWMEB
708744765236445186,2016-03-12 20:01:34,Is an 'intelligence officer' a good person or a bad person? It depends when it was said... https://t.co/PmXr5dcvj4 https://t.co/jzxHyGhRFt
708729664626360320,2016-03-12 19:01:34,"From heist to mayhem, @susie_dent takes a look at the language of crime. https://t.co/ojh9UI4RQw https://t.co/c0XGJbUw56"
708714616101195776,2016-03-12 18:01:46,What does the future of South African English look like? https://t.co/JZlkAWwbT5 https://t.co/FwGpQP3AfS
708699558516232192,2016-03-12 17:01:56,OED Editor James Murray didn't actually like the word 'dictionary'… find out more: https://t.co/AVJR4qEvsi https://t.co/tHXjbpTP6j
708684418056101889,2016-03-12 16:01:46,What put the 'flea' in flea market? https://t.co/swqdIT61Jl https://t.co/JlmvGdiuLO
708669221853597696,2016-03-12 15:01:23,Jack Kerouac was born #OTD in 1922. We pay tribute by looking at idioms with the word ‘road’ https://t.co/wYvl9aXlqH https://t.co/7FTtzEtwZL
708654207365210116,2016-03-12 14:01:43,How does punctuation in ancient poetry work? https://t.co/ZJiGRj4mr0 https://t.co/0yOdSh5IJC
708639089176801280,2016-03-12 13:01:39,We interview the @OED contributor who helped us antedate the term 'African American'. https://t.co/C9HAzcJsKg https://t.co/IXkmg5ynBI
708623911966081024,2016-03-12 12:01:20,We explore a footballing corpus for some of the most popular words. https://t.co/053ZPaB9wb https://t.co/WhH7PfjUNg
708608797531623425,2016-03-12 11:01:17,Drunk tank pink? Our blog post examines some unusual terms for unusual colours. https://t.co/XHrVXa0e2y https://t.co/R2F8Es717t
708593684196016128,2016-03-12 10:01:14,Take a look at the hidden eponyms in everyday English: https://t.co/l7DvaIJJat https://t.co/EmQszkvwT5
708578554909478912,2016-03-12 09:01:06,The linguistic lure of country music is explored in our blog post. https://t.co/yMHjMzN49c https://t.co/XYijjwpI3l
708563445965262848,2016-03-12 08:01:04,A story about how one child discovered the @OED… https://t.co/lKpxOPI7ur https://t.co/LQpKy3ErBN
708548320751386624,2016-03-12 07:00:58,"Manspreading: what is it, and why has the term grown in popularity? https://t.co/nEzTpibocU https://t.co/TecRJ0vkxg"
708534286543101952,2016-03-12 06:05:12,Have you been tempted to learn Dragonese? https://t.co/sKFs78n7br https://t.co/GjrSkMEvw2
708518079769219072,2016-03-12 05:00:48,Did you know that @OED Editor James Murray also collected stamps? https://t.co/8EbSKouzQr https://t.co/0ZALxeYhQu
708503008062078976,2016-03-12 04:00:55,Explore the unusual history of the word 'rum'. https://t.co/lJxsRsto2j https://t.co/0jo9uWE43M
708487956751896576,2016-03-12 03:01:06,"Feathers, catching crabs, and getting bumped: the language of rowing. https://t.co/QZrY30uVMg https://t.co/bGbT0rw2C6"
708472879780859904,2016-03-12 02:01:11,Discover the unexpectedly odd history of 'parting shot'. https://t.co/5PzUvQafsO https://t.co/2YHjN26tGO
708457808585433088,2016-03-12 01:01:18,"From boiled shirt to step-in, we look at the unusual language of clothes. https://t.co/OI4lsZ7J0w https://t.co/KuMpuOurxW"
708447011293536258,2016-03-12 00:18:24,Word of the Day: veriest - the degree to which a description applies…... https://t.co/9PbKGaQv3r
708442720885411840,2016-03-12 00:01:21,Drive safe? What happens when adverbs lose their 'ly': https://t.co/eXy33S1513 https://t.co/LLCyg7icX5
708427688210538496,2016-03-11 23:01:37,Will 'upstander' enter Oxford Dictionaries? Here are the reasons for and against. https://t.co/Lom185O78H https://t.co/VsF1KIp6SX
708412606336397313,2016-03-11 22:01:41,Whatever happened to the brontosaurus? https://t.co/EOgJltEB5I https://t.co/QIu1TKmTnj
708397590988132353,2016-03-11 21:02:01,"Skivers and scroungers… and, perhaps surprisingly, birds: https://t.co/rUsuFTWdZK https://t.co/4CHAbff9l4"
708382523118776320,2016-03-11 20:02:09,What's the connection between hobbits and fireworks? Find out in our blog post. https://t.co/khClvKVLNy https://t.co/QJ4XMqPq93
708367438371528704,2016-03-11 19:02:12,Was there ever a real McCoy? The answer is a little more complicated than you might expect. https://t.co/WErMz5kuvp https://t.co/LIKBzvt6ks
